{
  "schema": "agentic-synth-twin/canonical-synth-state/v1",
  "plugin": {
    "clap_id": "org.surge-synth-team.clap-saw-demo",
    "name": "Clap Saw Demo Synth",
    "vendor": "Surge Synth team",
    "version": "1.0.0",
    "source_repository": "https://github.com/abique/clap-saw-demo",
    "source_commit": "f33b31fff459d66ac18207ec152b323aaa9306f9"
  },
  "parameters": [
    {
      "id": 1378,
      "name": "Unison Count",
      "module": "Oscillator",
      "unit": null,
      "min": 1,
      "max": 7,
      "default": 3,
      "current": 3,
      "flags": 33,
      "automatable": true,
      "modulatable": false
    },
    {
      "id": 2391,
      "name": "Unison Spread in Cents",
      "module": "Oscillator",
      "unit": null,
      "min": 0,
      "max": 100,
      "default": 10,
      "current": 10,
      "flags": 7200,
      "automatable": true,
      "modulatable": true
    },
    {
      "id": 8675309,
      "name": "Oscillator Detuning (in cents)",
      "module": "Oscillator",
      "unit": null,
      "min": -200,
      "max": 200,
      "default": 0,
      "current": 0,
      "flags": 7200,
      "automatable": true,
      "modulatable": true
    },
    {
      "id": 2874,
      "name": "Amplitude Attack (s)",
      "module": "Amplitude Envelope Generator",
      "unit": null,
      "min": 0,
      "max": 1,
      "default": 0.01,
      "current": 0.01,
      "flags": 32,
      "automatable": true,
      "modulatable": false
    },
    {
      "id": 728,
      "name": "Amplitude Release (s)",
      "module": "Amplitude Envelope Generator",
      "unit": null,
      "min": 0,
      "max": 1,
      "default": 0.2,
      "current": 0.2,
      "flags": 32,
      "automatable": true,
      "modulatable": false
    },
    {
      "id": 1942,
      "name": "Deactivate Amp Envelope",
      "module": "Amplitude Envelope Generator",
      "unit": null,
      "min": 0,
      "max": 1,
      "default": 0,
      "current": 0,
      "flags": 33,
      "automatable": true,
      "modulatable": false
    },
    {
      "id": 87612,
      "name": "Pre Filter VCA",
      "module": "Filter",
      "unit": null,
      "min": 0,
      "max": 1,
      "default": 1,
      "current": 1,
      "flags": 7200,
      "automatable": true,
      "modulatable": true
    },
    {
      "id": 17,
      "name": "Cutoff in Keys",
      "module": "Filter",
      "unit": null,
      "min": 1,
      "max": 127,
      "default": 69,
      "current": 69,
      "flags": 7200,
      "automatable": true,
      "modulatable": true
    },
    {
      "id": 94,
      "name": "Resonance",
      "module": "Filter",
      "unit": null,
      "min": 0,
      "max": 1,
      "default": 0.7,
      "current": 0.7,
      "flags": 7200,
      "automatable": true,
      "modulatable": true
    },
    {
      "id": 14255,
      "name": "Filter Type",
      "module": "Filter",
      "unit": null,
      "min": 0,
      "max": 5,
      "default": 0,
      "current": 0,
      "flags": 33,
      "automatable": true,
      "modulatable": false
    }
  ],
  "opaque_state": {
    "encoding": "base64",
    "byte_length": 97,
    "sha256": "8e9ad156e9e8ab9a0cf001acdfd9aa84a4c4e7c20138e6bf8c53c05021a7c022",
    "data": "U1RSRUFNLVZFUlNJT04tMTsxNDI1NT0wOzg3NjEyPTE7OTQ9MC43OzE3PTY5OzE5NDI9MDsxMzc4PTM7Mjg3ND0wLjAxOzg2NzUzMDk9MDsyMzkxPTEwOzcyOD0wLjI7AA=="
  },
  "evidence": {
    "capture_method": "clap.params+clap.state",
    "parameter_count": 10,
    "selected_parameter_restore_verified": true
  }
}
